{
  "version": "1.0",
  "title": "Worlds Weather and Climate",
  "subject_classification": "theory",
  "domain": "social-studies",
  "complexity_level": "elementary",
  "target_audience": "Class 5, ages 9-11",
  "learning_objectives": [
    "Explain the difference between weather and climate.",
    "Identify and describe the factors affecting climate.",
    "Understand the different types of climate found in the world.",
    "Recognize the climatic zones of the Earth.",
    "Explain how climate affects human life and the environment."
  ],
  "metadata": {
    "subject": "social-studies",
    "subject_label": "Social Studies",
    "grade": 5,
    "chapter": 3,
    "narration_speed": 0.85,
    "delivery_policy": {
      "estimated_wpm": 140,
      "heading_pause_seconds": 2,
      "topic_pause_seconds": 1.5
    },
    "production_scope": {
      "user_approved": true,
      "start_section_id": "s01-title",
      "end_section_id": "s28-wordbank",
      "exclude_assessments": true,
      "description": "Opening through Word Bank, original PDF pages 1-7."
    },
    "source_audit": "D:\\InkSpectrum\\OpenMontage\\textbook-collections\\class-5-social\\reviewed\\chapter-03\\audits\\source-audit.json",
    "approval": {
      "status": "approved",
      "evidence": "User requested remaining chapters sequentially and explicitly requested Chapter 3 generation on 2026-10-06."
    },
    "plan_origin": "reviewed-curated-source-contract",
    "source_block_count": 80,
    "required_source_block_count": 80,
    "mapped_required_source_block_count": 80
  },
  "sections": [
    {
      "render_mode": "video_gen",
      "transition_to_next": "crossfade",
      "section_id": "s01-title",
      "title": "Lesson 3: Worlds Weather and Climate",
      "description": "A child-friendly 3D sunny meadow with clouds and distant snowy mountains, moving foliage and a gently gliding camera; reserve the left area for the exact chapter title.",
      "narration_script": "Social Studies, Class 5. Lesson 3: Worlds Weather and Climate.",
      "teaching_contract": {
        "source_excerpts": [
          {
            "block_id": "p0001-b0001",
            "verbatim_text": "Lesson 3: Worlds Weather and Climate",
            "display_text": "Lesson 3: Worlds Weather and Climate",
            "narrate_verbatim": true
          }
        ],
        "explanations": [],
        "questions": [],
        "animation_beats": [
          {
            "cue_text": "Social Studies, Class 5. Lesson 3:",
            "visual": "A child-friendly 3D sunny meadow with clouds and distant snowy mountains, moving foliage and a gently gliding camera; reserve the left area for the exact chapter title.",
            "action": "A child-friendly 3D sunny meadow with clouds and distant snowy mountains, moving foliage and a gently gliding camera; reserve the left area for the exact chapter title."
          }
        ]
      },
      "equations": [],
      "duration_seconds": 8,
      "source_block_ids": [
        "p0001-b0001"
      ],
      "source_text": "Lesson 3: Worlds Weather and Climate",
      "source_document_block_type": "chapter_title",
      "source_semantic_role": "lesson_content",
      "source_page_number": 1,
      "source_bbox": [],
      "source_fragments": [
        {
          "block_id": "p0001-b0001",
          "page_number": 1,
          "block_type": "chapter_title",
          "semantic_role": "lesson_content",
          "source_text": "Lesson 3: Worlds Weather and Climate",
          "bbox": []
        }
      ],
      "source_block_type": "intro"
    },
    {
      "render_mode": "video_gen",
      "transition_to_next": "crossfade",
      "section_id": "s02-objectives",
      "title": "Learning Objectives",
      "description": "Readable exact learning-objective list with aligned subtitles; retain a stable cream reading card.",
      "narration_script": "Learning Objectives. By the end of this chapter, learners will be able to: Explain the difference between weather and climate. Identify and describe the factors affecting climate. Understand the different types of climate found in the world. Recognize the climatic zones of the Earth. Explain how climate affects human life and the environment.",
      "teaching_contract": {
        "source_excerpts": [
          {
            "block_id": "p0001-b0002",
            "verbatim_text": "Learning Objectives",
            "display_text": "Learning Objectives",
            "narrate_verbatim": true
          },
          {
            "block_id": "p0001-b0003",
            "verbatim_text": "By the end of this chapter, learners will be able to:",
            "display_text": "By the end of this chapter, learners will be able to:",
            "narrate_verbatim": true
          },
          {
            "block_id": "p0001-b0004",
            "verbatim_text": "Explain the difference between weather and climate.",
            "display_text": "Explain the difference between weather and climate.",
            "narrate_verbatim": true
          },
          {
            "block_id": "p0001-b0005",
            "verbatim_text": "Identify and describe the factors affecting climate.",
            "display_text": "Identify and describe the factors affecting climate.",
            "narrate_verbatim": true
          },
          {
            "block_id": "p0001-b0006",
            "verbatim_text": "Understand the different types of climate found in the world.",
            "display_text": "Understand the different types of climate found in the world.",
            "narrate_verbatim": true
          },
          {
            "block_id": "p0001-b0007",
            "verbatim_text": "Recognize the climatic zones of the Earth.",
            "display_text": "Recognize the climatic zones of the Earth.",
            "narrate_verbatim": true
          },
          {
            "block_id": "p0001-b0008",
            "verbatim_text": "Explain how climate affects human life and the environment.",
            "display_text": "Explain how climate affects human life and the environment.",
            "narrate_verbatim": true
          }
        ],
        "explanations": [],
        "questions": [],
        "animation_beats": [
          {
            "cue_text": "Learning Objectives. By the end of",
            "visual": "Readable exact learning-objective list with aligned subtitles; retain a stable cream reading card.",
            "action": "Readable exact learning-objective list with aligned subtitles; retain a stable cream reading card."
          }
        ]
      },
      "equations": [],
      "duration_seconds": 27,
      "source_block_ids": [
        "p0001-b0002",
        "p0001-b0003",
        "p0001-b0004",
        "p0001-b0005",
        "p0001-b0006",
        "p0001-b0007",
        "p0001-b0008"
      ],
      "source_text": "Learning Objectives\nBy the end of this chapter, learners will be able to:\nExplain the difference between weather and climate.\nIdentify and describe the factors affecting climate.\nUnderstand the different types of climate found in the world.\nRecognize the climatic zones of the Earth.\nExplain how climate affects human life and the environment.",
      "source_document_block_type": "section_heading",
      "source_semantic_role": "lesson_content",
      "source_page_number": 1,
      "source_bbox": [],
      "source_fragments": [
        {
          "block_id": "p0001-b0002",
          "page_number": 1,
          "block_type": "section_heading",
          "semantic_role": "lesson_content",
          "source_text": "Learning Objectives",
          "bbox": []
        },
        {
          "block_id": "p0001-b0003",
          "page_number": 1,
          "block_type": "paragraph",
          "semantic_role": "lesson_content",
          "source_text": "By the end of this chapter, learners will be able to:",
          "bbox": []
        },
        {
          "block_id": "p0001-b0004",
          "page_number": 1,
          "block_type": "bullet",
          "semantic_role": "lesson_content",
          "source_text": "Explain the difference between weather and climate.",
          "bbox": []
        },
        {
          "block_id": "p0001-b0005",
          "page_number": 1,
          "block_type": "bullet",
          "semantic_role": "lesson_content",
          "source_text": "Identify and describe the factors affecting climate.",
          "bbox": []
        },
        {
          "block_id": "p0001-b0006",
          "page_number": 1,
          "block_type": "bullet",
          "semantic_role": "lesson_content",
          "source_text": "Understand the different types of climate found in the world.",
          "bbox": []
        },
        {
          "block_id": "p0001-b0007",
          "page_number": 1,
          "block_type": "bullet",
          "semantic_role": "lesson_content",
          "source_text": "Recognize the climatic zones of the Earth.",
          "bbox": []
        },
        {
          "block_id": "p0001-b0008",
          "page_number": 1,
          "block_type": "bullet",
          "semantic_role": "lesson_content",
          "source_text": "Explain how climate affects human life and the environment.",
          "bbox": []
        }
      ]
    },
    {
      "render_mode": "video_gen",
      "transition_to_next": "crossfade",
      "section_id": "s03-startup",
      "title": "Start-Up",
      "description": "An Indian schoolchild looks out a classroom window onto sunny, cloudy and rainy weather cues; time weather changes to the spoken words.",
      "narration_script": "Start-Up. Look outside the window! Is it sunny, cloudy, or rainy? Have you ever noticed how the weather changes throughout the day? Some places are always warm, while others are cold. Why does this happen? In this chapter, we will explore the differences between weather and climate and understand the factors that influence them.",
      "teaching_contract": {
        "source_excerpts": [
          {